{
  "schemaVersion": "makers-anvil.config.local-settings.v1",
  "claimState": "staged",
  "runtimeData": {
    "mode": "platform-user-data",
    "logicalRoot": "makers-anvil-data://user",
    "environmentOverride": "MAKERS_ANVIL_DATA_DIR",
    "sourceRootDependency": false,
    "absolutePathExposed": false
  },
  "directories": [
    {
      "id": "settings",
      "relativePath": "settings",
      "purpose": "local user settings"
    },
    {
      "id": "intake",
      "relativePath": "intake",
      "purpose": "metadata-only intake records"
    },
    {
      "id": "jobs",
      "relativePath": "jobs",
      "purpose": "future job records"
    },
    {
      "id": "outputs",
      "relativePath": "outputs",
      "purpose": "future output bundles"
    },
    {
      "id": "logs",
      "relativePath": "logs",
      "purpose": "local diagnostic logs"
    },
    {
      "id": "tmp",
      "relativePath": "tmp",
      "purpose": "temporary app-owned working data"
    }
  ],
  "safety": {
    "userUploadEnabled": false,
    "routeExecutionEnabled": false,
    "toolLaunchEnabled": false,
    "archiveExtractionEnabled": false,
    "folderImportEnabled": false,
    "deleteUserDataEnabled": false,
    "releasePackagingEnabled": false
  }
}
